{
  "$schema": "https://json-schema.org/draft/2020-12/schema",
  "$id": "https://herald.dev/schemas/herald-oss/sink-kind-vocabulary.schema.json",
  "title": "Sink-kind vocabulary contract",
  "description": "Canonical structured record pinning the three names a sink's 'kind' carries across Herald layers, and the rule that says which name is canonical at each boundary. A sink's identity crosses several boundaries — the catalog endpoint, the instance store, the bootstrap JSON, the Build() dispatch, the provider-resolution call, and the sink implementation itself. Each boundary speaks one of three vocabularies: catalog kind (the wire/storage name), OSS kind (the QuickLogBuilder call-site name), or provider class (implementation-internal). This record is the single source of truth so the divergence Jared and Richard fixed during the sink-kind unification work cannot regrow. The doc-site contract page, any future API reference, and the FakeServer/OSS xmldoc cross-references all read from this record. Edit once; every render regenerates.",
  "type": "object",
  "required": [
    "surface",
    "version",
    "title",
    "last_reviewed",
    "vocabularies",
    "layers",
    "rule",
    "consequence",
    "do_dont"
  ],
  "additionalProperties": false,
  "properties": {
    "surface": {
      "type": "string",
      "pattern": "^[a-z0-9][a-z0-9-]*[a-z0-9]$",
      "minLength": 1,
      "description": "URL-safe slug for this contract record. Lowercase alphanumerics and hyphens. Used as the file slug and the deep-link namespace."
    },
    "version": {
      "type": "string",
      "pattern": "^[0-9]{4}-[0-9]{2}-[0-9]{2}$",
      "description": "ISO-8601 date of the record's last substantive update (YYYY-MM-DD). Bumped any time the rule, the layer table, or a vocabulary changes."
    },
    "last_reviewed": {
      "type": "string",
      "pattern": "^[0-9]{4}-[0-9]{2}-[0-9]{2}$",
      "description": "ISO-8601 date the record was last verified against the live code (YYYY-MM-DD). A stale review date means the record is suspect until re-checked against the source files in 'source_files'."
    },
    "title": {
      "type": "string",
      "minLength": 1,
      "description": "Human-readable title rendered on the page hero."
    },
    "ratified_by": {
      "type": "string",
      "description": "Who ratified the canonical rule (e.g. 'Richard, architecture-designer'). Optional, but recorded when the rule was the output of an architectural decision."
    },
    "source_files": {
      "type": "array",
      "description": "The code files this record was verified against. The renderer lists these so the next reader can re-check the record against the live code.",
      "items": {
        "type": "object",
        "required": ["repo", "path", "role"],
        "additionalProperties": false,
        "properties": {
          "repo": { "type": "string", "minLength": 1 },
          "path": { "type": "string", "minLength": 1 },
          "role": {
            "type": "string",
            "minLength": 1,
            "description": "What this file proves about the contract (e.g. 'Build() dispatch switch — matches catalog kind')."
          }
        }
      }
    },
    "vocabularies": {
      "type": "array",
      "description": "The three names a sink's kind can take. Each is named once here and referenced by id from the layer table.",
      "minItems": 1,
      "items": {
        "type": "object",
        "required": ["id", "name", "definition", "examples"],
        "additionalProperties": false,
        "properties": {
          "id": {
            "type": "string",
            "enum": ["catalog-kind", "oss-kind", "provider-class"],
            "description": "Stable identifier the layer rows reference."
          },
          "name": {
            "type": "string",
            "minLength": 1,
            "description": "The display name of the vocabulary (e.g. 'catalog kind')."
          },
          "definition": {
            "type": "string",
            "minLength": 1,
            "description": "One-sentence definition of what this vocabulary is and where it is allowed to appear."
          },
          "examples": {
            "type": "array",
            "minItems": 1,
            "items": { "type": "string", "minLength": 1 },
            "description": "Representative tokens in this vocabulary."
          },
          "may_appear_on_wire": {
            "type": "boolean",
            "description": "True when this vocabulary is allowed in any stored or transmitted field. The whole point of the contract: only catalog kind is true."
          }
        }
      }
    },
    "layers": {
      "type": "array",
      "description": "Each boundary a sink identity crosses, and which vocabulary it speaks. This is the layer-to-vocabulary mapping that is the heart of the record.",
      "minItems": 1,
      "items": {
        "type": "object",
        "required": ["layer", "symbol", "speaks", "example"],
        "additionalProperties": false,
        "properties": {
          "layer": {
            "type": "string",
            "minLength": 1,
            "description": "The boundary or component (e.g. 'Catalog endpoint', 'Bootstrap JSON')."
          },
          "symbol": {
            "type": "string",
            "minLength": 1,
            "description": "The concrete code symbol or field at this layer (e.g. 'SinkCatalogEntry.KindKey', 'sinks[].kind')."
          },
          "speaks": {
            "type": "string",
            "enum": ["catalog-kind", "oss-kind", "provider-class"],
            "description": "Which vocabulary id this layer uses."
          },
          "example": {
            "type": "string",
            "minLength": 1,
            "description": "A concrete example value at this layer (e.g. 'herald.json-file', 'json_file', 'WriterLogger (never surfaced)')."
          }
        }
      }
    },
    "rule": {
      "type": "object",
      "required": ["statement", "canonical", "scoped", "forbidden"],
      "additionalProperties": false,
      "description": "The canonical rule, broken into the statement plus the three vocabulary dispositions.",
      "properties": {
        "statement": {
          "type": "string",
          "minLength": 1,
          "description": "The one-paragraph rule, written at a high-school reading level."
        },
        "canonical": {
          "type": "string",
          "minLength": 1,
          "description": "Where the catalog/wire kind is canonical."
        },
        "scoped": {
          "type": "string",
          "minLength": 1,
          "description": "Where the OSS kind is allowed, and only there."
        },
        "forbidden": {
          "type": "string",
          "minLength": 1,
          "description": "Where the provider class must never appear."
        }
      }
    },
    "consequence": {
      "type": "object",
      "required": ["summary", "detail"],
      "additionalProperties": false,
      "description": "The concrete consequence of getting the rule wrong — why this is a real bug, not a style preference.",
      "properties": {
        "summary": {
          "type": "string",
          "minLength": 1,
          "description": "One sentence naming the failure."
        },
        "detail": {
          "type": "string",
          "minLength": 1,
          "description": "The cause-and-effect walk: stored provider class -> dispatch miss -> silent sink drop."
        }
      }
    },
    "do_dont": {
      "type": "object",
      "required": ["do", "dont"],
      "additionalProperties": false,
      "description": "The one-line do/don't a future contributor reads first.",
      "properties": {
        "do": { "type": "string", "minLength": 1 },
        "dont": { "type": "string", "minLength": 1 }
      }
    },
    "analogy": {
      "type": "string",
      "description": "The callout analogy that anchors the catalog-kind-vs-provider-class distinction. Rendered as a quick-picture callout box."
    }
  }
}
